{
  "schema_version": "1.0",
  "cell_id": "proxmox-cell-a",
  "collected_at": "2026-05-29T02:05:00Z",
  "collection_errors": [],

  "services": [
    {
      "name": "forgejo",
      "vm": "forgejo",
      "vmid": 101,
      "port": 3000,
      "protocol": "https",
      "url": "https://forgejo.internal",
      "status": "running",
      "health_check_url": "https://forgejo.internal/api/healthz",
      "last_health_check": "2026-05-29T02:04:00Z",
      "contract_declared": true,
      "secret_references": ["forgejo-admin-password", "forgejo-deploy-key"],
      "owner": "infrastructure",
      "notes": null
    },
    {
      "name": "assessment-engine",
      "vm": "assessment-engine",
      "vmid": 103,
      "port": 22,
      "protocol": "ssh",
      "url": null,
      "status": "running",
      "health_check_url": null,
      "last_health_check": null,
      "contract_declared": true,
      "secret_references": ["assessment-engine-deploy-key"],
      "owner": "infrastructure",
      "notes": null
    },
    {
      "name": "inventory",
      "vm": "inventory",
      "vmid": 102,
      "port": 22,
      "protocol": "ssh",
      "url": null,
      "status": "running",
      "health_check_url": null,
      "last_health_check": null,
      "contract_declared": false,
      "secret_references": ["inventory-deploy-key"],
      "owner": "infrastructure",
      "notes": "No service contract declared yet — Phase 7.1"
    }
  ],

  "dns_registrations": [
    {
      "hostname": "pve01.internal",
      "ip": "192.168.1.10",
      "ttl": 300,
      "record_type": "A",
      "in_dns_registry": true,
      "drift_from_registry": false
    },
    {
      "hostname": "forgejo.internal",
      "ip": "192.168.1.21",
      "ttl": 300,
      "record_type": "A",
      "in_dns_registry": true,
      "drift_from_registry": false
    },
    {
      "hostname": "inventory.internal",
      "ip": "192.168.1.22",
      "ttl": 300,
      "record_type": "A",
      "in_dns_registry": true,
      "drift_from_registry": false
    },
    {
      "hostname": "assessment.internal",
      "ip": "192.168.1.23",
      "ttl": 300,
      "record_type": "A",
      "in_dns_registry": true,
      "drift_from_registry": false
    }
  ],

  "backup_assignments": [
    {
      "vmid": 100,
      "vm_name": "infra-bootstrap",
      "backup_job_id": "pbs-daily-vms",
      "schedule": "daily at 02:00",
      "datastore": "main",
      "pbs_host": "pbs.internal",
      "last_run_at": "2026-05-29T02:00:00Z",
      "last_run_status": "ok",
      "last_successful_backup_at": "2026-05-29T02:00:00Z",
      "backup_age_hours": 0.08,
      "in_contract": false
    },
    {
      "vmid": 101,
      "vm_name": "forgejo",
      "backup_job_id": "pbs-daily-vms",
      "schedule": "daily at 02:00",
      "datastore": "main",
      "pbs_host": "pbs.internal",
      "last_run_at": "2026-05-29T02:00:00Z",
      "last_run_status": "ok",
      "last_successful_backup_at": "2026-05-29T02:00:00Z",
      "backup_age_hours": 0.08,
      "in_contract": true
    },
    {
      "vmid": 102,
      "vm_name": "inventory",
      "backup_job_id": "pbs-daily-vms",
      "schedule": "daily at 02:00",
      "datastore": "main",
      "pbs_host": "pbs.internal",
      "last_run_at": "2026-05-29T02:00:00Z",
      "last_run_status": "ok",
      "last_successful_backup_at": "2026-05-29T02:00:00Z",
      "backup_age_hours": 0.08,
      "in_contract": false
    },
    {
      "vmid": 103,
      "vm_name": "assessment-engine",
      "backup_job_id": "pbs-daily-vms",
      "schedule": "daily at 02:00",
      "datastore": "main",
      "pbs_host": "pbs.internal",
      "last_run_at": "2026-05-29T02:00:00Z",
      "last_run_status": "ok",
      "last_successful_backup_at": "2026-05-29T02:00:00Z",
      "backup_age_hours": 0.08,
      "in_contract": true
    }
  ]
}
